{
  "task_id": "002",
  "branch": "loop/002-phase-0-hid-capture",
  "status": "PASS",
  "iteration": 2,
  "max_iterations": 3,
  "acceptance_criteria": [
    {
      "id": "AC1",
      "description": "Define a reproducible, non-destructive HID capture procedure covering required USB/HID metadata, descriptors, reports, controls, and report lengths.",
      "status": "PASS",
      "evidence": "docs/feather-quantizer/phase-0-capture.md: capture procedure, sections 1-5."
    },
    {
      "id": "AC2",
      "description": "Define the target-device and connection-mode capture matrix for ELECOM DEFT and ELECOM HUGE PLUS without inventing the DEFT model number or results.",
      "status": "PASS",
      "evidence": "docs/feather-quantizer/phase-0-capture.md: Target matrix."
    },
    {
      "id": "AC3",
      "description": "Define deterministic evidence naming and schema that separates observed bytes from interpretation and annotation.",
      "status": "PASS",
      "evidence": "docs/feather-quantizer/research/hid-captures/README.md: deterministic paths and JSON/NDJSON schemas."
    },
    {
      "id": "AC4",
      "description": "Define explicit checks against the KQM constraints identified in Task 001 and cite their repository evidence.",
      "status": "PASS",
      "evidence": "docs/feather-quantizer/phase-0-capture.md: KQM compatibility worksheet with source symbols."
    },
    {
      "id": "AC5",
      "description": "Document the Feather USB host safety boundary for GP16/GP17 and the evidence process for GP18 VBUS polarity and timing without guessing.",
      "status": "PASS",
      "evidence": "docs/feather-quantizer/phase-0-capture.md: Safety and preparation."
    },
    {
      "id": "AC6",
      "description": "State explicitly that Task 002 does not prove DEFT or HUGE PLUS compatibility and that later hardware evidence is required.",
      "status": "PASS",
      "evidence": "Both deliverable introductions and review rules explicitly disclaim compatibility."
    },
    {
      "id": "AC7",
      "description": "Maintain valid loop state and append-only iteration evidence for Task 002.",
      "status": "PASS",
      "evidence": "state.json validates and iterations.md preserves initialization plus Iterations 1-2."
    }
  ],
  "quality": {
    "score": 98,
    "hard_gates": {
      "HG1": "PASS",
      "HG2": "PASS",
      "HG3": "NA",
      "HG4": "PASS",
      "HG5": "PASS",
      "HG6": "PASS",
      "HG7": "PASS",
      "HG8": "PASS",
      "HG9": "PASS",
      "HG10": "PASS"
    }
  },
  "hardware": {
    "requirement": "NONE",
    "evidence_available": false,
    "evidence": []
  },
  "last_failure_signature": null,
  "same_failure_count": 0,
  "updated_at": "2026-09-07T12:34:00Z"
}
